<?xml version="1.0" encoding="UTF-8"?>
<entrega xmlns:xsi="http://www.w3.org/2001/XMLSchema-instance"
         xsi:noNamespaceSchemaLocation="ejercicioNUEVE.xsd">
    <lote>
        <pale>
            <numcajas>3</numcajas>
            <contenido>
                <nombrecomponente>Fuentes</nombrecomponente>
                <numserie>3A</numserie>
                <pesounidad>2kg</pesounidad>
                <unidades>50</unidades>
            </contenido>
            <peso>100kg</peso>
            <formamanipulacion>Manual</formamanipulacion>
        </pale>
    </lote>
    <lote>
        <pale>
            <numcajas>2</numcajas>
            <contenido>
                <nombrecomponente>CPUs</nombrecomponente>
                <procedencia>
                    <pais>China</pais>
                    <pais>Corea del Sur</pais>
                </procedencia>
                <numserie>5B</numserie>
                <pesounidad>100g</pesounidad>
                <unidades>1000</unidades>
            </contenido>
            <peso>100kg</peso>
            <formamanipulacion>Manual</formamanipulacion>
        </pale>
    </lote>
</entrega>